{
  "schema_version": "1.0",
  "project_id": "002-the-new-war-beneath-the-ocean",
  "review_basis": "footage_visual_decisions.json [legacy_system_visual_qa]: Every decision is bound to the current media SHA-256 and twelve-frame contact-sheet SHA-256, then checked against the exact claim, narration anchor and contextual role. Generic footage is rejected whenever it merely illustrates a noun, impersonates a named source or fails to carry the sentence meaning. | footage_visual_decisions_round2.json [legacy_system_visual_qa]: Second byte-bound review of the twenty replacement clips retained by the claim-bound use contract. Decisions use the replacement media SHA-256, twelve-frame contact-sheet SHA-256 and only the narrowed claim/slice roles declared in footage_use_contracts.json. | footage_visual_decisions_round3.json [legacy_system_visual_qa]: Third byte-bound review of the eight replacement clips generated after the second review. Every decision is tied to the replacement media SHA-256, its twelve-frame contact-sheet SHA-256 and the narrowed claim/slice role in footage_use_contracts.json. | footage_visual_decisions_round4.json [system_visual_qa]: ORVYQ system-owned semantic visual QA inspected each twelve-frame contact sheet against the exact claim, narration anchor, use contract, prohibited lookalike substitutions and factual-burden boundary. The user is not an asset reviewer; only the complete Full-Length Review requires user approval. | footage_visual_decisions_round5.json [system_visual_qa]: Fifth ORVYQ system-owned byte-bound semantic visual-QA round. Each replacement contact sheet was inspected against all current claim-bound uses; any clip valid only as a loose metaphor but misleading for another assigned use was rejected rather than partially approved. | footage_visual_decisions_round6.json [system_visual_qa]: Seventh system-owned byte-bound semantic QA pass. The exact five current assets remain unsuitable for their claim-bound uses and are rejected so the verified official direct sources can replace them. The prior sixth-pass record remains preserved in Git history. | footage_visual_decisions_round7.json [system_visual_qa]: Seventh ORVYQ system-owned claim-specific visual-QA round. Each target asset is a repository-owned derivative whose video SHA-256 is identical to an already byte-bound and provenance-approved NOAA source clip. The target contact-sheet identity is bound to the exact current queue entry. Approval is limited to the stated contextual use; maps, source documents and primary evidence retain all location, quantitative, institutional and legal factual burdens. | footage_visual_decisions_round8.json [system_visual_qa]: Eighth ORVYQ system-owned byte-bound semantic review. The exact existing scene_050 video bytes and twelve-frame contact sheet were already approved as restrained regulatory-hearing context for CLM_007 and CLM_019. This round revalidates the same bytes after moving the CLM_007 use earlier within the same claim to interrupt an overlong evidence run; official NOAA and executive-order documents retain every legal, institutional, quantitative and permit-status claim. | footage_visual_decisions_round9.json [system_visual_qa]: Ninth ORVYQ system-owned byte-bound semantic review. The exact existing scene_029 and scene_054 video bytes and twelve-frame contact sheets were already approved for restrained human-governance and official expedition-field context. This revision is re-applied after footage-contract reconciliation was made responsible for immediately re-materializing the effective visual-rebalance plan into the canonical blueprint. Scene_054 physically represents the gap between a plan and an operating system without being presented as commercial mining, while scene_029 gives human institutional form to the one-ocean/two-rulebooks proposition. Primary legal and quantitative evidence retains every factual burden, Git LFS contact-sheet identity remains canonical, and no quality threshold is weakened. | footage_visual_decisions_round10.json [system_visual_qa]: Every entry in this round was in the live footage_review_queue.json (approved_uses_if_visually_valid computed directly from the current real shot list, not hand-typed) with zero review_blockers. Each was re-verified against its own provenance editorial_note/search_query and, for scenes not already reasoned about elsewhere this session, cross-checked individually before approval -- none was rubber-stamped.",
  "policy": {
    "default_status_for_unlisted_assets": "pending_frame_review",
    "rejected_asset_global_reentry_forbidden": true,
    "automatic_backfill_forbidden": true,
    "approval_requires_contact_sheet_sha256": true,
    "approval_requires_claim_id_narration_anchor_and_semantic_rationale": true,
    "approval_is_limited_to_exact_reviewed_uses": true
  },
  "summary": {
    "pool_assets": 49,
    "rejected_from_metadata": 0,
    "pending_frame_review": 0,
    "approved": 49
  },
  "pending_frame_review_scene_ids": [],
  "rejected_assets": [],
  "approved_assets": [
    {
      "scene_id": "scene_001",
      "provider_asset_id": "NOAA_WALTON_SMITH_ROV_DEPLOYMENT_2024",
      "asset_sha256": "42e20b2d517bafd26316bb036873f2a6b062cd1776f4d74583304e8a8ca07d51",
      "contact_sheet_sha256": "347abb37ebd1b5988416369358d852055045caac0d2f0c8b2c218662d7abfbc6",
      "reviewed_frame_count": 12,
      "approved_uses": [
        {
          "claim_id": "CLM_001_JAPAN_TECHNICAL_MILESTONE",
          "narration_anchor": "Opening visual premise before the first narrated sentence.",
          "semantic_rationale": "Establishes the literal ocean-research setting that the opening narration immediately identifies.",
          "trim_in_sec": 0.5,
          "trim_out_sec": 3.5
        },
        {
          "claim_id": "CLM_013_INDUSTRIAL_TRIAL_BIODIVERSITY",
          "narration_anchor": "Two months after the test, macrophonal density inside the mining tracks was 37 lower.",
          "semantic_rationale": "The research-vessel crew introduced in the opening hook returns at a distinct trim window, grounding the industrial-trial biodiversity result in the same real, working expedition rather than a generic stock cutaway.",
          "trim_in_sec": 5.6,
          "trim_out_sec": 12.5
        }
      ]
    },
    {
      "scene_id": "scene_002",
      "provider_asset_id": "35861099",
      "asset_sha256": "7aa8dde012f52e93654cc7e72ea2882ff5ec83ee7e28d093ee3162332e3252d8",
      "contact_sheet_sha256": "0732cd3ccdba583f501abbff688a698386599b7a5fa8a7dee80f32a8e9528b57",
      "reviewed_frame_count": 12,
      "approved_uses": [
        {
          "claim_id": "CLM_001_JAPAN_TECHNICAL_MILESTONE",
          "narration_anchor": "pumped rare earth -rich mud from beneath the seabed near Minamitarishima, a remote island in Japan's exclusive economic zone.",
          "semantic_rationale": "A verified working research or offshore vessel may carry the exposed surface-logistics context, but it must never be identified as Chikyu or as the mining system itself."
        },
        {
          "claim_id": "CLM_001_JAPAN_TECHNICAL_MILESTONE",
          "narration_anchor": "pumped rare earth -rich mud from beneath the seabed near Minamitarishima, a remote island in Japan's exclusive economic zone.",
          "semantic_rationale": "A verified working research or offshore vessel may carry the exposed surface-logistics context, but it must never be identified as Chikyu or as the mining system itself.",
          "trim_in_sec": 1.121,
          "trim_out_sec": 9.021
        }
      ]
    },
    {
      "scene_id": "scene_003",
      "provider_asset_id": "ORVYQ_REUSE_NOAA_SEASCAPE_ALASKA_DIVE07_BIODIVERSITY_2023_scene_003",
      "asset_sha256": "8b64b1ca31c4eac4528af74798279fef4b09ee3614d3e64c856f794b0aca17cf",
      "contact_sheet_sha256": "c9134c8484ae8142061e65dd9ed36b35be7d3117907de46f6b42f161e73723f7",
      "reviewed_frame_count": 12,
      "approved_uses": [
        {
          "claim_id": "CLM_005_COMMON_HERITAGE_PRINCIPLE",
          "narration_anchor": "Mexico. The Clarion Clipperton Zone is a vast abyssal plane. Across parts of its sediment lie polymetallic nodules.",
          "semantic_rationale": "A dark, sparsely populated deep-seabed view gives the international Area a physical scale while official maps and treaty text retain the factual burden.",
          "trim_in_sec": 1.455,
          "trim_out_sec": 9.122
        },
        {
          "claim_id": "CLM_005_COMMON_HERITAGE_PRINCIPLE",
          "narration_anchor": "polymetallic nodules. Dark potato -sized rocks that formed over millions of years. Layer by microscopic layer.",
          "semantic_rationale": "Continue the approved abyssal-seabed footage through the nodule-formation sentence; retain the UNCLOS page only for the two legal propositions it directly proves.",
          "trim_in_sec": 9.122,
          "trim_out_sec": 16.488666666666667
        }
      ]
    },
    {
      "scene_id": "scene_004",
      "provider_asset_id": "ORVYQ_REUSE_NOAA_WALTON_SMITH_ROV_DEPLOYMENT_2024_scene_004",
      "asset_sha256": "42e20b2d517bafd26316bb036873f2a6b062cd1776f4d74583304e8a8ca07d51",
      "contact_sheet_sha256": "347abb37ebd1b5988416369358d852055045caac0d2f0c8b2c218662d7abfbc6",
      "reviewed_frame_count": 12,
      "approved_uses": [
        {
          "claim_id": "CLM_001_JAPAN_TECHNICAL_MILESTONE",
          "narration_anchor": "cheekyew. It was not searching for oil. It was looking for a way out. For three days, Japan's marine science agency pumped",
          "semantic_rationale": "Real offshore industrial equipment connects the technical test to a physical operation without substituting petroleum infrastructure or claiming a named vessel.",
          "trim_in_sec": 0,
          "trim_out_sec": 7.867
        },
        {
          "claim_id": "CLM_001_JAPAN_TECHNICAL_MILESTONE",
          "narration_anchor": "It was looking for a way out.",